{
  "$schema": "../schema/reason.schema.json",
  "name": "deal-hunter",
  "displayName": "Deal Hunter",
  "description": "Finds the real lowest price for something you want, including shipping, tax and returns, and watches it if you like. Works from a product name or link, and never buys anything for you.",
  "categories": [
    "personal"
  ],
  "appearance": {
    "color": "amber",
    "eyes": "wide",
    "glasses": "magnifier",
    "accessory": "none"
  },
  "plugins": [],
  "skills": [
    "getting-started",
    "best-price-now",
    "add-to-watchlist",
    "price-watch-check"
  ]
}
