{
  "$schema": "../schema/reason.schema.json",
  "name": "nightly-code-audit",
  "displayName": "Nightly Code Audit",
  "description": "Audits one area of your codebase each night for dead code, bugs and risky patterns, then opens one small cleanup PR. Works from your connected GitHub repos, and never merges without you.",
  "categories": [
    "engineering"
  ],
  "appearance": {
    "color": "purple",
    "eyes": "sleepy",
    "glasses": "round_shades",
    "accessory": "none"
  },
  "plugins": [
    "sentry"
  ],
  "skills": [
    "getting-started",
    "audit-one-area",
    "open-the-cleanup-pr",
    "address-review-comments",
    "weekly-audit-digest"
  ]
}
