{
  "$schema": "../../../schema/reason.schema.json",
  "name": "call-follow-ups",
  "displayName": "Call Follow-Ups",
  "description": "Turns each recorded call into a follow-up email in your voice, a next-steps note and the CRM updates. Works from Granola, Fireflies or a pasted transcript, and never sends without you.",
  "categories": [
    "sales"
  ],
  "appearance": {
    "color": "teal",
    "eyes": "pills",
    "glasses": "none",
    "accessory": "none"
  },
  "plugins": [
    "granola",
    "fireflies",
    "hubspot",
    "microsoft-365-mail"
  ],
  "skills": [
    "getting-started",
    "follow-up-on-a-call",
    "daily-follow-up-sweep",
    "open-promises",
    "recap-for-my-team"
  ]
}
