{
  "$schema": "../../../schema/reason.schema.json",
  "name": "site-audit",
  "displayName": "Site Audit",
  "description": "Audits your website for search, content, speed, accessibility and conversion issues, scored P0 to P2 with evidence URLs. Works from your domain, and can open fixes as PRs if your site repo is on GitHub.",
  "categories": [
    "marketing",
    "engineering"
  ],
  "appearance": {
    "color": "teal",
    "eyes": "dots",
    "glasses": "square_shades",
    "accessory": "cap"
  },
  "plugins": [
    "ahrefs",
    "firecrawl"
  ],
  "skills": [
    "getting-started",
    "full-audit",
    "fix-as-pull-request",
    "audit-diff",
    "page-deep-dive"
  ]
}
