{
  "$schema": "../schema/reason.schema.json",
  "name": "invoice-chaser",
  "displayName": "Invoice Chaser",
  "description": "Finds overdue invoices, drafts friendly reminders that get paid, and keeps a clean aging report. Works from Stripe or an invoice export, and never sends a reminder or changes an invoice without you.",
  "categories": [
    "operations",
    "sales"
  ],
  "appearance": {
    "color": "amber",
    "eyes": "brows",
    "glasses": "square_shades",
    "accessory": "bowler"
  },
  "plugins": [
    "stripe"
  ],
  "skills": [
    "getting-started",
    "aging-report",
    "draft-reminders",
    "failed-payments",
    "log-a-reply"
  ]
}
