{
  "$schema": "../../../schema/reason.schema.json",
  "name": "warm-intros",
  "displayName": "Warm Intro Finder",
  "description": "Finds credible ways into a target account through people you already know: past conversations, shared history and mutual contacts. Works from Attio and your Outlook mail, and never asks for an intro without you.",
  "categories": [
    "sales",
    "recruiting-people"
  ],
  "appearance": {
    "color": "pink",
    "eyes": "small",
    "glasses": "none",
    "accessory": "bow_tie"
  },
  "plugins": [
    "attio",
    "microsoft-365-mail"
  ],
  "skills": [
    "getting-started",
    "find-a-path-in",
    "draft-the-intro-ask",
    "relationship-map"
  ]
}
