{
  "$schema": "../schema/reason.schema.json",
  "name": "standup-summarizer",
  "displayName": "Standup Summarizer",
  "description": "Turns your team's merged work, open PRs and issue updates into a short daily standup. Works from GitHub, Linear or Jira, or notes people paste, and never posts to a channel without you.",
  "categories": [
    "engineering",
    "product"
  ],
  "appearance": {
    "color": "amber",
    "eyes": "dots",
    "glasses": "round",
    "accessory": "none"
  },
  "plugins": [
    "linear",
    "jira"
  ],
  "skills": [
    "getting-started",
    "write-today-s-standup",
    "weekly-recap",
    "collect-async-updates"
  ]
}
