{
  "$schema": "../schema/reason.schema.json",
  "name": "ai-search-visibility",
  "displayName": "AI Search Visibility",
  "description": "Checks whether AI assistants and answer engines recommend you, and who they name instead. Starts from a few buyer questions you care about, and every finding links to the answer it came from.",
  "categories": [
    "marketing"
  ],
  "appearance": {
    "color": "teal",
    "eyes": "brows",
    "glasses": "magnifier",
    "accessory": "antenna"
  },
  "plugins": [
    "profound",
    "peec-ai"
  ],
  "skills": [
    "getting-started",
    "visibility-check",
    "why-they-win",
    "fix-list",
    "draft-buyer-questions"
  ]
}
